{
  "$schema": "https://json-schema.org/draft/2020-12/schema",
  "$id": "https://yumoframe.dev/templates/rotating-flow/storyboard.schema.json",
  "type": "object",
  "required": ["version", "template", "scenes"],
  "properties": {
    "version": { "const": "0.1.0" },
    "template": { "const": "rotating-flow" },
    "duration": { "type": "number", "exclusiveMinimum": 0 },
    "endOverview": { "type": "boolean" },
    "source": { "type": "object" },
    "theme": { "type": "object" },
    "audio": { "type": "object" },
    "scenes": {
      "type": "array",
      "minItems": 1,
      "items": {
        "type": "object",
        "required": ["lines"],
        "properties": {
          "lines": {
            "type": "array",
            "minItems": 1,
            "maxItems": 4,
            "items": { "$ref": "#/$defs/line" }
          }
        },
        "additionalProperties": false
      }
    }
  },
  "additionalProperties": false,
  "$defs": {
    "line": {
      "type": "object",
      "required": ["segments"],
      "properties": {
        "start": { "type": "number", "minimum": 0 },
        "end": { "type": "number", "exclusiveMinimum": 0 },
        "segments": {
          "type": "array",
          "minItems": 1,
          "items": {
            "type": "object",
            "required": ["text", "highlight"],
            "properties": {
              "text": { "type": "string", "minLength": 1 },
              "highlight": { "type": "boolean" }
            },
            "additionalProperties": false
          }
        }
      },
      "additionalProperties": false
    }
  }
}
