{
  "version": "0.1.0",
  "template": "rotating-flow",
  "endOverview": true,
  "scenes": [
    {
      "lines": [
        {
          "start": 0,
          "end": 0.8,
          "segments": [
            {
              "text": "示例",
              "highlight": false
            }
          ]
        }
      ]
    }
  ]
}
